{
  "$schema": "https://json-schema.org/draft/2020-12/schema",
  "type": "object",
  "required": ["schema_version", "source", "origin", "collected_at", "license_basis", "frames"],
  "properties": {
    "schema_version": {"const": 1},
    "source": {"type": "string", "minLength": 1},
    "origin": {"type": "string", "minLength": 1},
    "source_commit": {"type": "string"},
    "collected_at": {"type": "string"},
    "license_basis": {"type": "string", "minLength": 1},
    "frames": {"type": "array", "minItems": 1}
  }
}
