{
  "schema_version": 1,
  "source": "my",
  "origin": "old-repository-output/my/*_source.png",
  "source_commit": "8d251601ca551fbd5c05451f1fb337fc4b75362c",
  "collected_at": "2026-09-16T00:00:00Z",
  "license_basis": "local historical display artifact retained for migration validation; authorization to redistribute METMalaysia imagery has not been established",
  "frames": [
    {
      "product": "composite",
      "station": "peninsular",
      "valid_time": "2025-12-29T06:50:01Z",
      "uri": "http://www.met.gov.my/data/radar_peninsular.gif",
      "locator": {"station": "peninsular", "path": "radar_peninsular.gif"},
      "locator_version": "1",
      "revision": "legacy-output-a60936811a91",
      "metadata": {"time_binding": "legacy output filename agrees with the image's 14:50 Malaysia-time label; upstream response headers were not retained", "reference_shape": [640, 826], "raw_mode": "RGB", "scientific_reference_status": "blocked: canonical upstream bytes, reuse permission, palette and native geometry not verified"},
      "artifacts": [{"name": "peninsular.png", "path": "raw/peninsular.png", "role": "data", "media_type": "image/png", "sha256": "a60936811a91ae5f776759fc4072965c321eebc73431b78d3fba7fb1ebd7e68f"}]
    },
    {
      "product": "composite",
      "station": "east",
      "valid_time": "2025-12-29T06:52:01Z",
      "uri": "http://www.met.gov.my/data/radar_east.gif",
      "locator": {"station": "east", "path": "radar_east.gif"},
      "locator_version": "1",
      "revision": "legacy-output-c2e7cb2293de",
      "metadata": {"time_binding": "legacy output filename; upstream response headers and an independently verified display-time match were not retained", "reference_shape": [650, 1113], "raw_mode": "RGB", "scientific_reference_status": "blocked: canonical upstream bytes, reuse permission, palette and native geometry not verified"},
      "artifacts": [{"name": "east.png", "path": "raw/east.png", "role": "data", "media_type": "image/png", "sha256": "c2e7cb2293de39292c913c61c1405057f30a600eaed2b8fd33d62e04c6efaa9a"}]
    }
  ]
}
