{
  "schema_version": 1,
  "source": "nz",
  "origin": "https://mobile-apps.metservice.com/publicData/mobileRainRadar_rural_Kumeu",
  "source_commit": "official-live-api",
  "collected_at": "2026-09-18T03:50:00Z",
  "license_basis": "official MetService public mobile radar artifact retained for migration validation; production usage remains subject to upstream terms",
  "frames": [{
    "product": "rain",
    "station": "NZAU2",
    "valid_time": "2026-09-18T03:50:00Z",
    "uri": "https://mobile-apps.metservice.com/radarImage",
    "locator_version": "nz-legacy-v1",
    "revision": "NZAU2-1789703400",
    "metadata": {"reference_shape": [1200, 1200], "raw_format": "GIF", "geometry_status": "unverified", "scientific_reference_status": "blocked: palette/units not verified"},
    "artifacts": [{"name": "NZAU2.gif", "path": "raw/NZAU2.gif", "role": "data", "media_type": "image/gif", "sha256": "0d98e9bc3ac0cd1b25d303a1b40db3641e316fc85db75554b0b8053c9607f85e"}]
  }]
}
